{
  "type": "motion_task",
  "task_id": "ctrl-001",
  "device_id": "dev-1",
  "capability": "home",
  "source": "voice",
  "route_policy": {
    "route_role": "device_control",
    "model_required": false,
    "primary_strategy": "deterministic",
    "artifact_required": "none"
  },
  "params": {}
}
